====START OF DERECHO REGRESSION TESTING LOG====

UFSWM hash used in testing:
fe4bb76565de0a5f3261b276fa392d65cb046e96

Submodule hashes used in testing:
 37cbb7d6840ae7515a9a8f0dfd4d89461b3396d1 AQM (v0.2.0-37-g37cbb7d)
 be5d28fd1b60522e6fc98aefeead20e6aac3530b AQM/src/model/CMAQ (CMAQv5.2.1_07Feb2018-198-gbe5d28fd1)
 3d7067a523b8557058755289e4275f5f5c985daf CDEPS-interface/CDEPS (cdeps0.4.17-40-g3d7067a)
 c9e4679f449e30bb4cc0f22164b4401a8b50f7a6 CICE-interface/CICE (CICE6.0.0-447-gc9e4679)
 f6ff8f7c4d4cb6feabe3651b13204cf43fc948e3 CICE-interface/CICE/icepack (Icepack1.1.0-182-gf6ff8f7)
 4e19850cb083bc474b7cde5dc2f8506ec74cc442 CMEPS-interface/CMEPS (cmeps_v0.4.1-2306-g4e19850)
 cabd7753ae17f7bfcc6dad56daf10868aa51c3f4 CMakeModules (v1.0.0-28-gcabd775)
 da95cc428d8b626e99250fd57a4279b4980044f8 FV3 (heads/develop)
 97114888f529c2df70ed4a350fd2428df74839ff FV3/atmos_cubed_sphere (201912_public_release-389-g9711488)
 011db4f80a02cba6d65958ace56e8efb197be62b FV3/ccpp/framework (ccpp_transition_to_vlab_master_20190705-704-g011db4f)
 9b0ac7b16a45afe5e7f1abf9571d3484158a5b43 FV3/ccpp/physics (EP4-741-g9b0ac7b1)
 74a0e098b2163425e4b5466c2dfcf8ae26d560a5 FV3/ccpp/physics/physics/Radiation/RRTMGP/rte-rrtmgp (v1.6)
 5faac752d9550d3570705358fa1eb3f5ac78a786 FV3/upp (upp_v10.2.0-185-g5faac75)
-1ba8270870947b583cd51bc72ff8960f4c1fb36e FV3/upp/sorc/libIFI.fd
-7476b8f2790a47d788f79cebfdbb551567ae7cf8 FV3/upp/sorc/ncep_post.fd/post_gtg.fd
 041422934cae1570f2f0e67239d5d89f11c6e1b7 GOCART (sdr_v2.1.2.6-119-g0414229)
 35789c757766e07f688b4c0c7c5229816f224b09 HYCOM-interface/HYCOM (2.3.00-121-g35789c7)
 6d0150d6c212c7052e73aa8ab76418d5b28fb780 MOM6-interface/MOM6 (dev/master/repository_split_2014.10.10-10045-g6d0150d6c)
 9423197f894112edfcb1502245f7d7b873d551f9 MOM6-interface/MOM6/pkg/CVMix-src (9423197)
 29e64d652786e1d076a05128c920f394202bfe10 MOM6-interface/MOM6/pkg/GSW-Fortran (29e64d6)
 6a51f0295bc1a877475b527157a33aa86eb532fe NOAHMP-interface/noahmp (v3.7.1-426-g6a51f02)
 d9b3172f4197c65d471662c6952a668152d71230 WW3 (6.07.1-345-gd9b3172f)
 31e4e3e57bad8a7cdaa0ce2d3c4efbca63b5f74a stochastic_physics (ufs-v2.0.0-216-g31e4e3e)


NOTES:
[Times](Memory) are at the end of each compile/test in format [MM:SS](Size).
The first time is for the full script (prep+run+finalize).
The second time is specifically for the run phase.
Times/Memory will be empty for failed tests.

BASELINE DIRECTORY: /glade/derecho/scratch/epicufsrt/ufs-weather-model/RT//NEMSfv3gfs/develop-20240419
COMPARISON DIRECTORY: /glade/derecho/scratch/zshrader/FV3_RT/rt_68317

RT.SH OPTIONS USED:
* (-a) - HPC PROJECT ACCOUNT: nral0032
* (-l) - USE CONFIG FILE: rt.conf
* (-e) - USE ECFLOW

PASS -- COMPILE 's2swa_32bit_intel' [20:19, 19:02]
PASS -- TEST 'cpld_control_p8_mixedmode_intel' [08:58, 04:58](3073 MB)

PASS -- COMPILE 's2swa_32bit_pdlib_intel' [21:16, 20:24]
PASS -- TEST 'cpld_control_gfsv17_intel' [16:09, 13:47](1689 MB)
PASS -- TEST 'cpld_control_gfsv17_iau_intel' [18:48, 15:04](1824 MB)
PASS -- TEST 'cpld_restart_gfsv17_intel' [10:33, 07:07](959 MB)
PASS -- TEST 'cpld_mpi_gfsv17_intel' [18:06, 15:46](1665 MB)

PASS -- COMPILE 's2swa_32bit_pdlib_debug_intel' [10:16, 08:59]
PASS -- TEST 'cpld_debug_gfsv17_intel' [23:47, 21:22](1706 MB)

PASS -- COMPILE 's2swa_intel' [20:17, 19:06]
PASS -- TEST 'cpld_control_p8_intel' [09:05, 05:38](3091 MB)
PASS -- TEST 'cpld_control_p8.v2.sfc_intel' [09:14, 05:33](3095 MB)
PASS -- TEST 'cpld_restart_p8_intel' [06:50, 03:17](3150 MB)
PASS -- TEST 'cpld_control_qr_p8_intel' [09:05, 05:33](3125 MB)
PASS -- TEST 'cpld_restart_qr_p8_intel' [06:54, 03:20](3180 MB)
PASS -- TEST 'cpld_decomp_p8_intel' [08:54, 05:35](3090 MB)
PASS -- TEST 'cpld_mpi_p8_intel' [07:27, 04:37](3385 MB)
PASS -- TEST 'cpld_control_ciceC_p8_intel' [09:11, 05:38](3101 MB)
PASS -- TEST 'cpld_control_c192_p8_intel' [14:09, 08:43](3634 MB)
PASS -- TEST 'cpld_restart_c192_p8_intel' [14:48, 05:50](3616 MB)
PASS -- TEST 'cpld_bmark_p8_intel' [27:34, 09:39](4341 MB)
PASS -- TEST 'cpld_restart_bmark_p8_intel' [24:41, 07:03](4648 MB)
PASS -- TEST 'cpld_s2sa_p8_intel' [08:35, 05:12](3064 MB)

PASS -- COMPILE 's2sw_intel' [19:18, 18:31]
PASS -- TEST 'cpld_control_noaero_p8_intel' [06:46, 04:09](1685 MB)
PASS -- TEST 'cpld_control_nowave_noaero_p8_intel' [06:59, 04:12](1727 MB)

PASS -- COMPILE 's2swa_debug_intel' [10:15, 09:01]
PASS -- TEST 'cpld_debug_p8_intel' [09:56, 07:36](3151 MB)

PASS -- COMPILE 's2sw_debug_intel' [09:15, 08:28]
PASS -- TEST 'cpld_debug_noaero_p8_intel' [07:21, 05:10](1710 MB)

PASS -- COMPILE 's2s_aoflux_intel' [15:17, 14:05]
PASS -- TEST 'cpld_control_noaero_p8_agrid_intel' [07:53, 04:12](1728 MB)

PASS -- COMPILE 's2s_intel' [15:17, 14:02]
PASS -- TEST 'cpld_control_c48_intel' [08:14, 06:35](2670 MB)

PASS -- COMPILE 's2swa_faster_intel' [23:20, 22:47]
PASS -- TEST 'cpld_control_p8_faster_intel' [08:27, 05:28](3102 MB)

PASS -- COMPILE 's2sw_pdlib_intel' [20:19, 19:28]
PASS -- TEST 'cpld_control_pdlib_p8_intel' [16:55, 14:03](1708 MB)
PASS -- TEST 'cpld_restart_pdlib_p8_intel' [10:31, 07:16](1019 MB)
PASS -- TEST 'cpld_mpi_pdlib_p8_intel' [18:56, 16:00](1666 MB)

PASS -- COMPILE 's2sw_pdlib_debug_intel' [09:17, 08:32]
PASS -- TEST 'cpld_debug_pdlib_p8_intel' [25:46, 22:54](1718 MB)

PASS -- COMPILE 'atm_dyn32_intel' [13:18, 12:20]
PASS -- TEST 'control_flake_intel' [04:52, 03:23](667 MB)
PASS -- TEST 'control_CubedSphereGrid_intel' [04:30, 02:25](1567 MB)
PASS -- TEST 'control_CubedSphereGrid_parallel_intel' [04:54, 02:27](1572 MB)
PASS -- TEST 'control_latlon_intel' [04:31, 02:22](1572 MB)
PASS -- TEST 'control_wrtGauss_netcdf_parallel_intel' [04:34, 02:24](1568 MB)
PASS -- TEST 'control_c48_intel' [08:28, 06:13](1616 MB)
PASS -- TEST 'control_c48.v2.sfc_intel' [06:39, 05:17](734 MB)
PASS -- TEST 'control_c192_intel' [11:09, 08:39](1690 MB)
PASS -- TEST 'control_c384_intel' [16:38, 08:56](2011 MB)
PASS -- TEST 'control_c384gdas_intel' [17:05, 07:23](1199 MB)
PASS -- TEST 'control_stochy_intel' [02:43, 01:25](627 MB)
PASS -- TEST 'control_stochy_restart_intel' [02:45, 00:52](443 MB)
PASS -- TEST 'control_lndp_intel' [02:42, 01:22](626 MB)
PASS -- TEST 'control_iovr4_intel' [03:42, 02:05](625 MB)
PASS -- TEST 'control_iovr5_intel' [03:42, 02:06](624 MB)
PASS -- TEST 'control_p8_intel' [04:27, 02:30](1601 MB)
PASS -- TEST 'control_p8.v2.sfc_intel' [04:28, 02:30](1598 MB)
PASS -- TEST 'control_p8_ugwpv1_intel' [04:29, 02:28](1602 MB)
PASS -- TEST 'control_restart_p8_intel' [03:24, 01:24](804 MB)
PASS -- TEST 'control_noqr_p8_intel' [04:26, 02:30](1585 MB)
PASS -- TEST 'control_restart_noqr_p8_intel' [03:29, 01:23](805 MB)
PASS -- TEST 'control_decomp_p8_intel' [04:40, 02:32](1591 MB)
PASS -- TEST 'control_p8_lndp_intel' [06:28, 04:21](1605 MB)
PASS -- TEST 'control_p8_rrtmgp_intel' [05:45, 03:17](1659 MB)
PASS -- TEST 'control_p8_mynn_intel' [04:46, 02:30](1607 MB)
PASS -- TEST 'merra2_thompson_intel' [04:44, 02:48](1603 MB)
PASS -- TEST 'regional_control_intel' [06:07, 04:31](632 MB)
PASS -- TEST 'regional_restart_intel' [04:16, 02:33](800 MB)
PASS -- TEST 'regional_decomp_intel' [06:12, 04:43](629 MB)
PASS -- TEST 'regional_noquilt_intel' [06:03, 04:25](1159 MB)
PASS -- TEST 'regional_netcdf_parallel_intel' [06:04, 04:27](629 MB)
PASS -- TEST 'regional_2dwrtdecomp_intel' [06:00, 04:30](627 MB)
PASS -- TEST 'regional_wofs_intel' [07:07, 05:35](1606 MB)

PASS -- COMPILE 'rrfs_intel' [12:14, 10:56]
PASS -- TEST 'rap_control_intel' [08:21, 06:06](1008 MB)
PASS -- TEST 'regional_spp_sppt_shum_skeb_intel' [07:00, 03:41](1191 MB)
PASS -- TEST 'rap_decomp_intel' [08:22, 06:23](1006 MB)
PASS -- TEST 'rap_restart_intel' [05:16, 03:11](882 MB)
PASS -- TEST 'rap_sfcdiff_intel' [08:21, 06:04](1007 MB)
PASS -- TEST 'rap_sfcdiff_decomp_intel' [08:15, 06:23](1003 MB)
PASS -- TEST 'rap_sfcdiff_restart_intel' [06:12, 04:35](881 MB)
PASS -- TEST 'hrrr_control_intel' [05:14, 03:13](998 MB)
PASS -- TEST 'hrrr_control_decomp_intel' [05:19, 03:18](1006 MB)
PASS -- TEST 'hrrr_control_2threads_intel' [05:17, 02:49](1088 MB)
PASS -- TEST 'hrrr_control_restart_intel' [02:53, 01:44](832 MB)
PASS -- TEST 'rrfs_v1beta_intel' [08:05, 05:57](1001 MB)
PASS -- TEST 'rrfs_v1nssl_intel' [08:39, 07:21](1956 MB)
PASS -- TEST 'rrfs_v1nssl_nohailnoccn_intel' [08:40, 07:10](1950 MB)

PASS -- COMPILE 'csawmg_intel' [11:13, 10:02]
PASS -- TEST 'control_csawmg_intel' [08:12, 05:48](695 MB)
PASS -- TEST 'control_ras_intel' [04:36, 02:51](660 MB)

PASS -- COMPILE 'wam_intel' [10:13, 09:21]
PASS -- TEST 'control_wam_intel' [03:34, 01:53](382 MB)

PASS -- COMPILE 'atm_faster_dyn32_intel' [13:20, 12:20]
PASS -- TEST 'control_p8_faster_intel' [04:52, 02:26](1606 MB)
PASS -- TEST 'regional_control_faster_intel' [06:16, 04:17](629 MB)

PASS -- COMPILE 'atm_debug_dyn32_intel' [09:17, 08:31]
PASS -- TEST 'control_CubedSphereGrid_debug_intel' [04:09, 02:29](1595 MB)
PASS -- TEST 'control_wrtGauss_netcdf_parallel_debug_intel' [04:23, 02:28](1600 MB)
PASS -- TEST 'control_stochy_debug_intel' [04:32, 02:50](800 MB)
PASS -- TEST 'control_lndp_debug_intel' [03:46, 02:33](798 MB)
PASS -- TEST 'control_csawmg_debug_intel' [06:06, 03:57](840 MB)
PASS -- TEST 'control_ras_debug_intel' [03:33, 02:40](806 MB)
PASS -- TEST 'control_diag_debug_intel' [04:38, 02:32](1666 MB)
PASS -- TEST 'control_debug_p8_intel' [04:10, 02:35](1628 MB)
PASS -- TEST 'regional_debug_intel' [17:13, 15:49](665 MB)
PASS -- TEST 'rap_control_debug_intel' [05:38, 04:39](1180 MB)
PASS -- TEST 'hrrr_control_debug_intel' [05:36, 04:33](1178 MB)
PASS -- TEST 'hrrr_gf_debug_intel' [05:32, 04:35](1182 MB)
PASS -- TEST 'hrrr_c3_debug_intel' [06:38, 04:39](1181 MB)
PASS -- TEST 'rap_unified_drag_suite_debug_intel' [06:34, 04:43](1181 MB)
PASS -- TEST 'rap_diag_debug_intel' [08:30, 04:51](1266 MB)
FAILED: RUN DID NOT COMPLETE -- TEST 'rap_cires_ugwp_debug_intel' [, ]( MB)
PASS -- TEST 'rap_unified_ugwp_debug_intel' [05:28, 04:44](1182 MB)
PASS -- TEST 'rap_lndp_debug_intel' [06:37, 04:42](1182 MB)
PASS -- TEST 'rap_progcld_thompson_debug_intel' [05:35, 04:48](1184 MB)
PASS -- TEST 'rap_noah_debug_intel' [05:34, 04:30](1184 MB)
PASS -- TEST 'rap_sfcdiff_debug_intel' [06:37, 04:48](1181 MB)
PASS -- TEST 'rap_noah_sfcdiff_cires_ugwp_debug_intel' [08:36, 07:27](1182 MB)
PASS -- TEST 'rrfs_v1beta_debug_intel' [05:41, 04:34](1178 MB)
PASS -- TEST 'rap_clm_lake_debug_intel' [06:44, 05:30](1183 MB)
PASS -- TEST 'rap_flake_debug_intel' [05:37, 04:37](1180 MB)
PASS -- TEST 'gnv1_c96_no_nest_debug_intel' [10:03, 07:53](1187 MB)

PASS -- COMPILE 'wam_debug_intel' [06:12, 05:11]
PASS -- TEST 'control_wam_debug_intel' [05:24, 04:36](418 MB)

PASS -- COMPILE 'rrfs_dyn32_phy32_intel' [10:17, 09:30]
PASS -- TEST 'regional_spp_sppt_shum_skeb_dyn32_phy32_intel' [06:45, 03:30](1059 MB)
PASS -- TEST 'rap_control_dyn32_phy32_intel' [07:02, 05:07](884 MB)
PASS -- TEST 'hrrr_control_dyn32_phy32_intel' [04:15, 02:45](881 MB)
PASS -- TEST 'hrrr_control_decomp_dyn32_phy32_intel' [05:05, 02:53](881 MB)
PASS -- TEST 'rap_restart_dyn32_phy32_intel' [06:06, 03:52](796 MB)
PASS -- TEST 'hrrr_control_restart_dyn32_phy32_intel' [02:47, 01:32](777 MB)

PASS -- COMPILE 'rrfs_dyn32_phy32_faster_intel' [12:19, 11:44]
PASS -- TEST 'conus13km_control_intel' [04:41, 01:52](1086 MB)
PASS -- TEST 'conus13km_2threads_intel' [03:31, 00:58](1086 MB)
PASS -- TEST 'conus13km_restart_mismatch_intel' [03:37, 01:07](972 MB)

PASS -- COMPILE 'rrfs_dyn64_phy32_intel' [11:13, 09:48]
PASS -- TEST 'rap_control_dyn64_phy32_intel' [05:07, 03:36](906 MB)

PASS -- COMPILE 'rrfs_dyn32_phy32_debug_intel' [07:11, 06:04]
PASS -- TEST 'rap_control_debug_dyn32_phy32_intel' [05:35, 04:29](1058 MB)
PASS -- TEST 'hrrr_control_debug_dyn32_phy32_intel' [05:30, 04:24](1058 MB)
PASS -- TEST 'conus13km_debug_intel' [16:03, 13:24](1134 MB)
PASS -- TEST 'conus13km_debug_qr_intel' [16:02, 13:34](818 MB)
PASS -- TEST 'conus13km_radar_tten_debug_intel' [15:50, 13:26](1203 MB)

PASS -- COMPILE 'rrfs_dyn64_phy32_debug_intel' [07:19, 05:58]
PASS -- TEST 'rap_control_dyn64_phy32_debug_intel' [05:34, 04:38](1081 MB)

PASS -- COMPILE 'hafsw_intel' [17:21, 16:01]
PASS -- TEST 'hafs_regional_atm_intel' [06:57, 04:34](720 MB)
PASS -- TEST 'hafs_regional_atm_thompson_gfdlsf_intel' [07:02, 05:02](1068 MB)
PASS -- TEST 'hafs_regional_atm_ocn_intel' [09:01, 06:24](774 MB)
PASS -- TEST 'hafs_regional_atm_wav_intel' [13:48, 10:49](798 MB)
PASS -- TEST 'hafs_regional_atm_ocn_wav_intel' [15:23, 12:01](819 MB)
PASS -- TEST 'hafs_regional_1nest_atm_intel' [06:26, 04:40](479 MB)
PASS -- TEST 'hafs_regional_telescopic_2nests_atm_intel' [07:47, 05:46](493 MB)
PASS -- TEST 'hafs_global_1nest_atm_intel' [04:08, 02:21](393 MB)
PASS -- TEST 'hafs_global_multiple_4nests_atm_intel' [09:59, 06:13](458 MB)
PASS -- TEST 'hafs_regional_specified_moving_1nest_atm_intel' [05:08, 03:15](513 MB)
PASS -- TEST 'hafs_regional_storm_following_1nest_atm_intel' [05:16, 03:02](512 MB)
PASS -- TEST 'hafs_regional_storm_following_1nest_atm_ocn_intel' [05:37, 03:45](587 MB)
PASS -- TEST 'hafs_global_storm_following_1nest_atm_intel' [02:37, 01:16](427 MB)
PASS -- TEST 'gnv1_nested_intel' [05:13, 03:22](787 MB)

PASS -- COMPILE 'hafsw_debug_intel' [08:19, 07:08]
PASS -- TEST 'hafs_regional_storm_following_1nest_atm_ocn_debug_intel' [14:15, 11:58](612 MB)

PASS -- COMPILE 'hafsw_faster_intel' [20:20, 19:52]
PASS -- TEST 'hafs_regional_storm_following_1nest_atm_ocn_wav_intel' [09:38, 07:10](631 MB)
PASS -- TEST 'hafs_regional_storm_following_1nest_atm_ocn_wav_inline_intel' [09:25, 07:09](688 MB)

PASS -- COMPILE 'hafs_mom6w_intel' [17:19, 16:44]
PASS -- TEST 'hafs_regional_storm_following_1nest_atm_ocn_wav_mom6_intel' [07:46, 05:17](679 MB)

PASS -- COMPILE 'hafs_all_intel' [15:19, 14:27]
PASS -- TEST 'hafs_regional_docn_intel' [07:49, 05:33](755 MB)
PASS -- TEST 'hafs_regional_docn_oisst_intel' [07:34, 05:33](737 MB)
PASS -- TEST 'hafs_regional_datm_cdeps_intel' [18:21, 16:09](894 MB)

PASS -- COMPILE 'datm_cdeps_intel' [08:17, 07:52]
PASS -- TEST 'datm_cdeps_control_cfsr_intel' [03:28, 02:29](760 MB)
PASS -- TEST 'datm_cdeps_restart_cfsr_intel' [02:29, 01:32](749 MB)
PASS -- TEST 'datm_cdeps_control_gefs_intel' [03:30, 02:20](644 MB)
PASS -- TEST 'datm_cdeps_iau_gefs_intel' [03:24, 02:24](643 MB)
PASS -- TEST 'datm_cdeps_stochy_gefs_intel' [03:25, 02:24](648 MB)
PASS -- TEST 'datm_cdeps_ciceC_cfsr_intel' [03:30, 02:28](761 MB)
PASS -- TEST 'datm_cdeps_bulk_cfsr_intel' [03:31, 02:29](761 MB)
PASS -- TEST 'datm_cdeps_bulk_gefs_intel' [03:25, 02:23](638 MB)
PASS -- TEST 'datm_cdeps_mx025_cfsr_intel' [08:17, 05:39](692 MB)
PASS -- TEST 'datm_cdeps_mx025_gefs_intel' [08:56, 05:39](673 MB)
PASS -- TEST 'datm_cdeps_multiple_files_cfsr_intel' [03:18, 02:28](762 MB)
PASS -- TEST 'datm_cdeps_3072x1536_cfsr_intel' [05:35, 03:54](2016 MB)
PASS -- TEST 'datm_cdeps_gfs_intel' [05:28, 03:54](2017 MB)

PASS -- COMPILE 'datm_cdeps_debug_intel' [06:18, 05:11]
PASS -- TEST 'datm_cdeps_debug_cfsr_intel' [06:29, 05:03](746 MB)

PASS -- COMPILE 'datm_cdeps_faster_intel' [08:22, 07:48]
PASS -- TEST 'datm_cdeps_control_cfsr_faster_intel' [03:36, 02:32](759 MB)

PASS -- COMPILE 'datm_cdeps_land_intel' [03:11, 02:20]
PASS -- TEST 'datm_cdeps_lnd_gswp3_intel' [02:36, 01:11](310 MB)
PASS -- TEST 'datm_cdeps_lnd_era5_intel' [02:34, 01:05](458 MB)
PASS -- TEST 'datm_cdeps_lnd_era5_rst_intel' [01:37, 00:41](450 MB)

PASS -- COMPILE 'atml_intel' [14:14, 13:00]
PASS -- TEST 'control_p8_atmlnd_sbs_intel' [09:35, 06:59](1628 MB)
PASS -- TEST 'control_p8_atmlnd_intel' [08:56, 06:22](1636 MB)
PASS -- TEST 'control_restart_p8_atmlnd_intel' [05:00, 03:31](855 MB)

PASS -- COMPILE 'atmw_intel' [13:20, 12:36]
PASS -- TEST 'atmwav_control_noaero_p8_intel' [03:26, 01:32](1641 MB)

PASS -- COMPILE 'atmaero_intel' [12:13, 11:05]
PASS -- TEST 'atmaero_control_p8_intel' [05:38, 03:38](2951 MB)
PASS -- TEST 'atmaero_control_p8_rad_intel' [06:38, 04:15](3000 MB)
PASS -- TEST 'atmaero_control_p8_rad_micro_intel' [06:10, 04:19](3012 MB)

PASS -- COMPILE 'atmaq_debug_intel' [07:20, 06:30]
PASS -- TEST 'regional_atmaq_debug_intel' [25:29, 22:05](4531 MB)

SYNOPSIS:
Starting Date/Time: 20240424 06:22:13
Ending Date/Time: 20240424 07:49:24
Total Time: 01h:27m:53s
Compiles Completed: 37/37
Tests Completed: 171/172
Failed Tests:
* TEST rap_cires_ugwp_debug_intel: FAILED: RUN DID NOT COMPLETE
-- LOG: /glade/work/zshrader/rt-2241/tests/logs/log_derecho/run_rap_cires_ugwp_debug_intel.log

NOTES:
A file 'test_changes.list' was generated with list of all failed tests.
You can use './rt.sh -c -b test_changes.list' to create baselines for the failed tests.
If you are using this log as a pull request verification, please commit 'test_changes.list'.

Result: FAILURE

====END OF DERECHO REGRESSION TESTING LOG====
====START OF DERECHO REGRESSION TESTING LOG====

UFSWM hash used in testing:
fe4bb76565de0a5f3261b276fa392d65cb046e96

Submodule hashes used in testing:
 37cbb7d6840ae7515a9a8f0dfd4d89461b3396d1 AQM (v0.2.0-37-g37cbb7d)
 be5d28fd1b60522e6fc98aefeead20e6aac3530b AQM/src/model/CMAQ (CMAQv5.2.1_07Feb2018-198-gbe5d28fd1)
 3d7067a523b8557058755289e4275f5f5c985daf CDEPS-interface/CDEPS (cdeps0.4.17-40-g3d7067a)
 c9e4679f449e30bb4cc0f22164b4401a8b50f7a6 CICE-interface/CICE (CICE6.0.0-447-gc9e4679)
 f6ff8f7c4d4cb6feabe3651b13204cf43fc948e3 CICE-interface/CICE/icepack (Icepack1.1.0-182-gf6ff8f7)
 4e19850cb083bc474b7cde5dc2f8506ec74cc442 CMEPS-interface/CMEPS (cmeps_v0.4.1-2306-g4e19850)
 cabd7753ae17f7bfcc6dad56daf10868aa51c3f4 CMakeModules (v1.0.0-28-gcabd775)
 da95cc428d8b626e99250fd57a4279b4980044f8 FV3 (heads/develop)
 97114888f529c2df70ed4a350fd2428df74839ff FV3/atmos_cubed_sphere (201912_public_release-389-g9711488)
 011db4f80a02cba6d65958ace56e8efb197be62b FV3/ccpp/framework (ccpp_transition_to_vlab_master_20190705-704-g011db4f)
 9b0ac7b16a45afe5e7f1abf9571d3484158a5b43 FV3/ccpp/physics (EP4-741-g9b0ac7b1)
 74a0e098b2163425e4b5466c2dfcf8ae26d560a5 FV3/ccpp/physics/physics/Radiation/RRTMGP/rte-rrtmgp (v1.6)
 5faac752d9550d3570705358fa1eb3f5ac78a786 FV3/upp (upp_v10.2.0-185-g5faac75)
-1ba8270870947b583cd51bc72ff8960f4c1fb36e FV3/upp/sorc/libIFI.fd
-7476b8f2790a47d788f79cebfdbb551567ae7cf8 FV3/upp/sorc/ncep_post.fd/post_gtg.fd
 041422934cae1570f2f0e67239d5d89f11c6e1b7 GOCART (sdr_v2.1.2.6-119-g0414229)
 35789c757766e07f688b4c0c7c5229816f224b09 HYCOM-interface/HYCOM (2.3.00-121-g35789c7)
 6d0150d6c212c7052e73aa8ab76418d5b28fb780 MOM6-interface/MOM6 (dev/master/repository_split_2014.10.10-10045-g6d0150d6c)
 9423197f894112edfcb1502245f7d7b873d551f9 MOM6-interface/MOM6/pkg/CVMix-src (9423197)
 29e64d652786e1d076a05128c920f394202bfe10 MOM6-interface/MOM6/pkg/GSW-Fortran (29e64d6)
 6a51f0295bc1a877475b527157a33aa86eb532fe NOAHMP-interface/noahmp (v3.7.1-426-g6a51f02)
 d9b3172f4197c65d471662c6952a668152d71230 WW3 (6.07.1-345-gd9b3172f)
 31e4e3e57bad8a7cdaa0ce2d3c4efbca63b5f74a stochastic_physics (ufs-v2.0.0-216-g31e4e3e)


NOTES:
[Times](Memory) are at the end of each compile/test in format [MM:SS](Size).
The first time is for the full script (prep+run+finalize).
The second time is specifically for the run phase.
Times/Memory will be empty for failed tests.

BASELINE DIRECTORY: /glade/derecho/scratch/epicufsrt/ufs-weather-model/RT//NEMSfv3gfs/develop-20240419
COMPARISON DIRECTORY: /glade/derecho/scratch/zshrader/FV3_RT/rt_96038

RT.SH OPTIONS USED:
* (-a) - HPC PROJECT ACCOUNT: nral0032
* (-l) - USE CONFIG FILE: rt.conf

PASS -- COMPILE 'atm_debug_dyn32_intel' [09:12, 08:38]
PASS -- TEST 'rap_cires_ugwp_debug_intel' [05:33, 04:42](1183 MB)

SYNOPSIS:
Starting Date/Time: 20240424 08:20:30
Ending Date/Time: 20240424 08:35:15
Total Time: 00h:14m:49s
Compiles Completed: 1/1
Tests Completed: 1/1

NOTES:
A file 'test_changes.list' was generated but is empty.
If you are using this log as a pull request verification, please commit 'test_changes.list'.

Result: SUCCESS

====END OF DERECHO REGRESSION TESTING LOG====